"Real-Time Multilingual Sentiment Analysis of Youtube Comments Using Automated NLP Pipelines: A Machine Learning Approach","A. K. M. Masum; M. H. Begum; M. M. Hassan; T. Rahman; A. K. Bitto; K. M. MohiUddin","Department of Computer Science and Engineering, Southeast University, Dhaka, Bangladesh; Department of Management Information System, International American University, Los Angeles, United States; Department of Computer Science and Engineering, Southeast University, Dhaka, Bangladesh; Computer Science and Engineering, International Islamic University, Chittagong, Chittagong, Bangladesh; Department of Software Engineering Major in Data Science, Daffodil International University, Dhaka, Bangladesh; Department of Computer Science and Engineering, Southeast University, Dhaka, Bangladesh","2025 IEEE International Conference for Women in Innovation, Technology & Entrepreneurship (ICWITE)","30 Dec 2025","2025","","","1","5","YouTube has become a major platform for comment, review, and opinion-sharing, especially through comments. Understanding the emotions of such comments can be extremely helpful to content creators, advertisers, and researchers. In this research work, we present an automated sentiment analysis system that can analyze YouTube comments in both English and Bangla. Through the Google YouTube API, we retrieve comments through the snippet feature. Since the dataset has mixed-language input, we preprocess the comments initially by deleting stop words, punctuation, and emojis. NonEnglish comments, which are primarily in Bangla, are detected using the Lang detect library and translated to English to have a uniformity in the dataset. The data is additionally cleaned and tokenized post-translation. We utilize the Text Blob library to find out the polarity (positive, negative, neutral) and subjectivity of every comment. To facilitate better feature representation, TF-IDF vectorization with n-grams is done. For dealing with class imbalance, we have used the SMOTE approach. Different machine learning algorithms are trained and tested by hyperparameter tuning. Logistic Regression achieved highest accuracy of 95% on C=10, and following that was Support Vector Machine (SVM) with a linear kernel's 94%. Our final system accepts as input any YouTube video link and returns an analysis of public sentiment based on the comments. Beyond enabling multilingual sentiment analysis, this is also a simple way of tracking feedback in real time on a range of linguistic content.","","978-1-6654-5762-0","10.1109/ICWITE64848.2025.11307000","","https://ieeexplore.ieee.org/stamp/stamp.jsp?arnumber=11307000","Multilingual Text Processing;Bangla NLP;English NLP;Machine Learning;YouTube Comment Analysis","Support vector machines;Sentiment analysis;Logistic regression;Video on demand;Translation;Machine learning algorithms;Real-time systems;Multilingual;Web sites;Tuning","","","","16","IEEE","30 Dec 2025","26-27 Sept. 2025","26-27 Sept. 2025","IEEE","IEEE Conferences"
"A Machine Learning Model for Sentiment Classification of Mobile Products Data","R. S. Baraka; Y. H. Jaber","Faculty of Information Technology, Islamic University of Gaza, Palestine; Graduate Studies of Information Technology, Islamic University of Gaza, Palestine",2023 24th International Arab Conference on Information Technology (ACIT),"18 Mar 2024","2023","","","1","7","Negative or positive opinions regarding a product affect the purchasing decisions of potential customers and hence the producing company. Based on these opinions, there is a need to determine the features affecting the product and its producer. In this paper, we present a machine learning model we have built for sentiment analysis of mobile product sentiment data coming from Twitter. It aims to categorize sentiments for a particular product of a particular mobile phone company. The model applies three classification algorithms; Naive Bayes (NB), Logistic Regression (LR), and Support Vector Machine (SVM) using two types of features, namely discrete features and continues features. We have compared their results using two types of classification models, supervised and semi-supervised with several test cases. With Fl-score of 80.26% for supervised and 87.64% for semi-supervised, the semi-supervised model outperforms the supervised model. Further research on continuous features is needed in the future as it does not require the use of a feature engineering process. This includes the use of word embeddings which perform well in related tasks.","2831-4948","979-8-3503-8430-7","10.1109/ACIT58888.2023.10453725","","https://ieeexplore.ieee.org/stamp/stamp.jsp?arnumber=10453725","Twitter Sentiment Data;Opinion Mining;Arabic Sentiment Analysis;Machine Learning;Mobile Products","Support vector machines;Analytical models;Sentiment analysis;Social networking (online);Blogs;Machine learning;Companies","","","","28","IEEE","18 Mar 2024","6-8 Dec. 2023","6-8 Dec. 2023","IEEE","IEEE Conferences"
"Story Point Estimation for Agile Projects Using K-Medoids Clustering and Weighted K-Nearest Neighbor Regression","A. R. James; W. Luhur; Meiliana","Computer Science Department, School of Computer Science, Bina Nusantara University, Jakarta, Indonesia; Computer Science Department, School of Computer Science, Bina Nusantara University, Jakarta, Indonesia; Computer Science Department, School of Computer Science, Bina Nusantara University, Jakarta, Indonesia",2025 Tenth International Conference on Informatics and Computing (ICIC),"30 Dec 2025","2025","","","1","6","Accurate story point estimation is critical for Agile sprint planning, but traditional methods are often inconsistent and machine learning alternatives can be overly complex. We propose a simple framework that estimates story points directly from user story descriptions. Our method uses TF-IDF vectorization and Non-Negative Matrix Factorization (NMF) to extract features, followed by k-medoids clustering to group similar issues. Within each cluster, a weighted k-nearest neighbors (k-NN) regression model predicts the story points. We evaluated our approach on a dataset of 21,140 issues from 26 open-source projects. Experimental results demonstrate that adding NMF to the TF-IDF pipeline provides negligible gains in accuracy. However, using weighted k-NN regression—especially with TF - IDF features alone—consistently outperforms simpler estimators like the cluster mean or median. Our findings suggest this streamlined framework offers a practical balance of simplicity and accuracy for Agile teams.","","979-8-3315-7583-0","10.1109/ICIC68054.2025.11309563","","https://ieeexplore.ieee.org/stamp/stamp.jsp?arnumber=11309563","story point estimation;software measurement;weighted k-NN;feature extraction;tawos","Accuracy;Pipelines;Estimation;Nearest neighbor methods;Predictive models;Feature extraction;Probabilistic logic;Planning;Software measurement;Informatics","","","","20","IEEE","30 Dec 2025","9-10 Oct. 2025","9-10 Oct. 2025","IEEE","IEEE Conferences"
"A Survey: Traffic Sign Recognition System using Learning Techniques","P. Sharma; P. Devare; A. Rasal; S. Kale; G. Jadhav","Department of Computer Engineering, (SKNCOE- Vadgaon), SPPU Pune, Pune, India; Department of Computer Engineering, (SKNCOE- Vadgaon), SPPU Pune, Pune, India; Department of Computer Engineering, (SKNCOE- Vadgaon), SPPU Pune, Pune, India; Department of Computer Engineering, (SKNCOE- Vadgaon), SPPU Pune, Pune, India; Department of Computer Engineering, (SKNCOE- Vadgaon), SPPU Pune, Pune, India",2024 IEEE 4th International Conference on ICT in Business Industry & Government (ICTBIG),"13 Mar 2025","2024","","","1","6","A very important aspect of the development of smart transportation networks and road safety is ‘traffic sign recognition’. This survey covers all types of learning techniques applied to traffic sign recognition with respect to effectiveness, challenges, and progress. The study begins with an overview of the foundational methods of traffic sign recognition: traditional image processing approaches and their limitations. Further below, the heart of the survey is modern learning techniques, especially 'machine learning (ML)’ and ‘deep learning (DL)’ approaches. The report reviews employ learning techniques applied in ‘traffic sign recognition systems’. It discusses both the most recent developments in deep learning and advanced machine learning as well as conventional image processing. The review ranges from classical techniques such as colour and shape-based recognition to modern techniques such as ‘Convolutional Neural Network (CNN),' which have significantly increased recognition accuracy. Several important datasets on which the training and evaluation should be done have been reported. One of them is ‘German Traffic Sign Recognition Benchmark’, and the challenges in practical applications along with the future research directions in this field have been highlighted. An overview has been provided regarding the effectiveness and evolution of learning techniques to improve ‘Traffic sign recognition systems’.","","979-8-3315-1898-1","10.1109/ICTBIG64922.2024.10911592","","https://ieeexplore.ieee.org/stamp/stamp.jsp?arnumber=10911592","traffic sign recognition;machine learning;convolution neural network;natural language processing (NLP)","Surveys;Training;Image recognition;Reviews;Image color analysis;Neural networks;Assistive technologies;Natural language processing;Road safety;Smart transportation","","2","","18","IEEE","13 Mar 2025","13-14 Dec. 2024","13-14 Dec. 2024","IEEE","IEEE Conferences"
"Arbitrary-Shaped Text Detection with Gaussian Probability Distance Distribution","L. Guo; Z. Chen; X. Chen","School of Electronics and Information Engineering, Soochow University, Suzhou, China; School of Electronics and Information Engineering, Soochow University, Suzhou, China; School of Electronics and Information Engineering, Soochow University, Suzhou, China",2022 IEEE 5th International Conference on Computer and Communication Engineering Technology (CCET),"4 Oct 2022","2022","","","58","64","With the development of semantic segmentation, segmentation-based methods have yielded great success in detecting arbitrary-shaped texts. However, many existing text detection methods use binary discrete distributions to predict shrunk text instances, which cannot generate complete and accurate text bounding boxes. In this paper, we propose an arbitrary-shaped scene text detection method based on predicting Gaussian probability distance map of the complete text region, and this map can retain more text boundary information. Then, the boundary pixels are clustered into high-confidence text centers by a learnable post-processing and false positives are filtered out by pixel-level score maps. We also propose an adaptive channel enhancement module to improve the pixel-level segmentation accuracy. Experiments on three standard datasets, including CTW1500, Total-Text, and MSRA-TD500, demonstrate that the proposed method achieves great robustness and performance. The method obtains an F-measure of S2.S% on CTW1500 and S3.0% on MSRA-TD500.","","978-1-6654-6735-3","10.1109/CCET55412.2022.9906393","","https://ieeexplore.ieee.org/stamp/stamp.jsp?arnumber=9906393","scene text detection;Gaussian probability distance map;arbitrary-shaped text","Detectors;Information filters;Robustness;Standards","","1","","30","IEEE","4 Oct 2022","19-21 Aug. 2022","19-21 Aug. 2022","IEEE","IEEE Conferences"
"An Optimization Strategy Allowing a Tactile Glove With Minimal Tactile Sensors for Soft Object Identification","M. Tang; X. Liu; X. Qiao; Y. Zhu; L. Fan; S. Du; D. Chen; J. Wang; Z. Zhang; W. Zhang; Y. Xiang; Y. Chen; J. Guo; Y. Fan","Key Laboratory of Biomechanics and Mechanobiology (Beihang University), Ministry of Education, Beijing, China; Key Laboratory of Biomechanics and Mechanobiology (Beihang University), Ministry of Education, Beijing, China; Key Laboratory of Biomechanics and Mechanobiology (Beihang University), Ministry of Education, Beijing, China; Key Laboratory of Biomechanics and Mechanobiology (Beihang University), Ministry of Education, Beijing, China; Key Laboratory of Biomechanics and Mechanobiology (Beihang University), Ministry of Education, Beijing, China; Key Laboratory of Biomechanics and Mechanobiology (Beihang University), Ministry of Education, Beijing, China; Key Laboratory of Biomechanics and Mechanobiology (Beihang University), Ministry of Education, Beijing, China; Key Laboratory of Biomechanics and Mechanobiology (Beihang University), Ministry of Education, Beijing, China; Key Laboratory of Biomechanics and Mechanobiology (Beihang University), Ministry of Education, Beijing, China; Key Laboratory of Biomechanics and Mechanobiology (Beihang University), Ministry of Education, Beijing, China; College of Information Engineering, Beijing Institute of Petrochemical Technology, Beijing, China; Key Laboratory of Biomechanics and Mechanobiology (Beihang University), Ministry of Education, Beijing, China; Key Laboratory of Biomechanics and Mechanobiology (Beihang University), Ministry of Education, Beijing, China; Key Laboratory of Biomechanics and Mechanobiology (Beihang University), Ministry of Education, Beijing, China",IEEE Journal of Biomedical and Health Informatics,"6 Nov 2025","2025","29","11","8175","8185","Humans can easily perceive the shapes and textures of grasped objects due to high-density mechanoreceptor networks in the hand. However, replicating this capability in wearable devices with limited sensors remains challenging. Here, we designed a tactile glove equipped with easily accessible sensors, enabling accurate identification of soft objects during grasping. We propose an optimization strategy to eliminate redundant sensors and determine the minimal sensor configuration, which was then integrated into the tactile glove. The results indicate that the minimal sensor configuration (n = 7) attached to the hand achieved accurate identification comparable to that obtained using a larger number of sensors (n = 22) distributed across the hand before elimination. Furthermore, we found that various machine learning classifiers achieved recognition accuracies of up to 90% for soft objects when using the tactile glove. Correlation analyses were conducted to characterize individual contribution and mutual cooperativity of regional tactile forces on the hand during grasping, aiding in the interpretation of sensor selection or elimination in the optimization strategy. Adequate validation and analysis demonstrate that our strategy allows an easy–to–apply solution for identifying soft objects via a tactile glove with a minimal number of sensors, offering valuable insights for guiding the design of tactile sensor layouts in artificial limbs and robotic teleoperation systems.","2168-2208","","10.1109/JBHI.2025.3576248","National Natural Science Foundation of China(grant numbers:12372326); Beijing Natural Science Foundation(grant numbers:L244020,QY24143); ","https://ieeexplore.ieee.org/stamp/stamp.jsp?arnumber=11023023","Tactile sensor;feature selection;smart glove;object identification","Sensors;Grasping;Object recognition;Hands;Accuracy;Intelligent sensors;Hidden Markov models;Tactile sensors;Sensor phenomena and characterization","Humans;Wearable Electronic Devices;Hand;Touch;Male;Adult;Hand Strength;Female;Machine Learning;Equipment Design;Young Adult;Signal Processing, Computer-Assisted","1","","48","IEEE","3 Jun 2025","Nov. 2025","","IEEE","IEEE Journals"
"Comparison of Machine Learning Models in Sentiment Analysis of User Reviews on the SP4N LAPOR! Application from Twitter","A. J. Khairurrijal; P. H. Gunawan; N. Aquarini","School of Computing, Telkom University, Bandung, Indonesia; School of Computing, Telkom University, Bandung, Indonesia; Ecole Doctorale Science Economics Université de Poitiers Intervenant Finance, La Rochelle, France",2025 IEEE International Conference on Artificial Intelligence and Mechatronics Systems (AIMS),"12 Nov 2025","2025","","","1","6","The rise of public service applications has transformed the way governments engage with citizens, enabling two-way communication and improved service delivery. SP4N LAPOR! is one such initiative of the Indonesian government that facilitates citizen complaints and suggestions. Despite its purpose, recent social media discourse-especially on Twit-ter-suggests public dissatisfaction with the platform. This study investigates public sentiment by applying and comparing five machine learning classifiers-Logistic Regression, Naïve Bayes, Support Vector Machine (SVM), Random Forest, and Decision Tree-on a dataset of 1,598 tweets mentioning SP4N LAPOR!, collected between 2016 and 2024. The preprocessing pipeline includes cleaning, normalization, tokenization, stopword removal, and stemming, followed by feature extraction using Term Frequency-Inverse Document Frequency (TFIDF). To mitigate class imbalance among sentiment categories (positive, neutral, negative), the Synthetic Minority Oversampling Technique (SMOTE) was applied. Evaluation was conducted using macro-averaged accuracy, precision, recall, and F1-score. Among the five models, Logistic Regression achieved the highest performance with $\mathbf{7 8. 6 \%}$ accuracy and $\mathbf{7 8. 5 \%} \mathbf{F 1}$-score, followed by Naïve Bayes and SVM. These findings highlight the strength of traditional, interpretable models in handling short and noisy texts typical of social media. The results offer practical implications for public institutions aiming to mine citizen feedback and optimize digital service experiences.","","979-8-3315-7805-3","10.1109/AIMS66189.2025.11229574","","https://ieeexplore.ieee.org/stamp/stamp.jsp?arnumber=11229574","Sentiment Analysis;SP4N LAPOR!;Logistic Regression;Social Media Mining;Twitter;Machine Learning","Support vector machines;Sentiment analysis;Logistic regression;Accuracy;Social networking (online);Pipelines;Government;Bayes methods;Regression tree analysis;Random forests","","","","25","IEEE","12 Nov 2025","24-25 May 2025","24-25 May 2025","IEEE","IEEE Conferences"
"Hybrid Machine Learning Model to Detect and Mitigate EMAIL Phishing Attacks","A. M. Fazil; P. S. V. Reddy; J. Eswar; S. Prabakeran","Department of Networking and Communications, SRM Institute of Science & Technology (SRMIST), Chengalpattu, India; Department of Networking and Communications, SRM Institute of Science & Technology (SRMIST), Chengalpattu, India; Department of Networking and Communications, SRM Institute of Science & Technology (SRMIST), Chengalpattu, India; Department of Networking and Communications, SRM Institute of Science & Technology (SRMIST), Chengalpattu, India","2025 International Conference on Advancements in Smart, Secure and Intelligent Computing (ASSIC)","17 Sep 2025","2025","","","1","6","The research develops an improved email classification system through the hybridization of Support Vector Machines with XGBoost to fight expanding phishing attacks while using TF-IDF vectorization for selecting significant text features. The classification pipeline of the classifier starts with SVM classifying examples from which XGBoost receives scores to perform refined classification. Multiple layer classification systems improve detection performance and enhance both the precision-recall measurements. A new signature extraction method enables the system to use TF-IDF for keeping and analyzing the key phishing patterns needed for real-time monitoring. The lightweight adaptive solution excels above conventional methods because it handles changing phishing threats effectively.","","979-8-3315-2302-2","10.1109/ASSIC64892.2025.11158403","","https://ieeexplore.ieee.org/stamp/stamp.jsp?arnumber=11158403","Phishing Detection;Machine Learning;Support Vector Machine (SVM);XGBoost;Cybersecurity;Email Classification;Phishing Mitigation;TF-IDF;Hybrid Model;Phishing Signatures","Support vector machines;Training;Phishing;System performance;Prevention and mitigation;Stacking;Machine learning;Real-time systems;Electronic mail;Protection","","","","15","IEEE","17 Sep 2025","16-18 May 2025","16-18 May 2025","IEEE","IEEE Conferences"
"A Pipeline Approach to Research Paper Recommendation System Integrating TF-IDF and KNN","S. Babu Dasari; P. V. Lakshmi Durga Keerthi; G. Snehitha","Velagapudi Ramakrishna Siddhartha Engineering College, Andhra Pradesh, India; Velagapudi Ramakrishna Siddhartha Engineering College, Andhra Pradesh, India; Velagapudi Ramakrishna Siddhartha Engineering College, Andhra Pradesh, India","2024 IEEE International Conference on Information Technology, Electronics and Intelligent Communication Systems (ICITEICS)","22 Aug 2024","2024","","","1","8","The literature review is a critical analysis of existing research papers, systematically summarizing and evaluating relevant studies, books, and sources to offer a comprehensive overview and identify gaps in knowledge. It guides researchers in formulating questions and contributes to the existing body of knowledge. However, researchers often struggle to locate suitable articles, especially those with limited search expertise. Traditional recommendation methods sometimes don't work well in the ever-changing world of academic papers. It's tough to keep up with the newest research and find high quality papers that are less cited. Recognizing these limitations, the proposed research paper recommendation system stands out as an innovative solution to help researchers overcome difficulties. At its core, the system employs a sophisticated pipelined hybrid approach, combining content-based strategies with collaborative filtering techniques. This integration aims to overcome the shortcomings of conventional methods by providing a more robust recommendation mechanism. Content-based methods include TF-IDF with cosine similarity. Collaborative filtering includes Knn, seamlessly blending content-based insights into collaborative filtering results. The system's dataset is sourced from ArXiv, which has provided open access to scholarly articles for almost 30 years. Spanning various fields, this extensive repository, available through Kaggle, encompasses 1.7 million articles with features like titles, authors, categories, abstracts, and full text PDFs. It offers significant depth for efficient data extraction. By blending the strengths of arXiv dataset, content-based and collaborative filtering, the system achieves a synergy that not only captures the richness of individual methods but also harnesses their combined power to deliver recommendations that are both timely and comprehensive.","","979-8-3503-8269-3","10.1109/ICITEICS61368.2024.10625308","","https://ieeexplore.ieee.org/stamp/stamp.jsp?arnumber=10625308","Research paper recommendation system;content based filtering;TF-IDF;cosine similarity;collaborative filtering;kNN;arXiv dataset","Open Access;Communication systems;Collaborative filtering;Pipelines;Nearest neighbor methods;Information filters;Feature extraction","","","","14","IEEE","22 Aug 2024","28-29 June 2024","28-29 June 2024","IEEE","IEEE Conferences"
"An Advanced Malware Detection System Based on NLP to Generate Genetic Markers","Q. D. Tran; J. Lim; F. Di Troia","Department of Computer Science, San Jose State University, CA, USA; Saratoga High School, Silicon Valley Cybersecurity Institute; San Jose State University, CA, USA",2024 IEEE International Conference on Consumer Electronics (ICCE),"28 Feb 2024","2024","","","1","6","Malware researchers are increasingly employing machine learning to counter sophisticated obfuscation techniques in malware activities. However, relying solely on machine learning models, especially with limited malware samples, is suboptimal. To enhance model effectiveness, careful data preprocessing is essential. To aid machine learning models in their learning process, we disassembled malware binary files into mnemonic opcode sequences and leveraging insights from Natural Language Processing, specifically Word2Vec and Doc2Vec. This methodology generates “genetic markers” proficient at capturing inherent malware attributes, effectively bypassing opcode obfuscation. Using various machine learning models—Naive Bayes, Logistic Regression, Support Vector Machine, Random Forest, Multi-layer Perceptron, and Convolutional biLSTM—we achieve promising results in distinguishing among 20 discrete malware families. Our findings reveal that employing customized Word2Vec and Doc2Vec models for distinct malware family datasets enhances the precision of “genetic markers.” This refinement boosts the learning capabilities of machine learning models, resulting in a robust detection rate of 99%.","2158-4001","979-8-3503-2413-6","10.1109/ICCE59016.2024.10444433","","https://ieeexplore.ieee.org/stamp/stamp.jsp?arnumber=10444433","Malware Detection;Natural Language Processing;Machine Learning;Embedding Vectors","Support vector machines;Logistic regression;Genetics;Malware;Natural language processing;Vectors;Random forests","","","","27","IEEE","28 Feb 2024","6-8 Jan. 2024","6-8 Jan. 2024","IEEE","IEEE Conferences"
