"DURFEX: A Feature Extraction Technique for Efficient Detection of Duplicate Bug Reports","K. K. Sabor; A. Hamou-Lhadj; A. Larsson","Software Behaviour Analysis (SBA) Research Lab ECE, Concordia University, Montréal, QC, Canada; Software Behaviour Analysis (SBA) Research Lab ECE, Concordia University, Montréal, QC, Canada; Senior Specialist Observability Ericsson, Stockholm, Sweden","2017 IEEE International Conference on Software Quality, Reliability and Security (QRS)","14 Aug 2017","2017","","","240","250","The detection of duplicate bug reports can help reduce the processing time of handling field crashes. This is especially important for software companies with a large client base where multiple customers can submit bug reports, caused by the same faults. There exist several techniques for the detection of duplicate bug reports; many of them rely on some sort of classification techniques applied to information extracted from stack traces. They classify each report using functions invoked in the stack trace associated with the bug report. The problem is that typical bug repositories may have stack traces that contain tens of thousands of functions, which causes the curse of dimensionality problem. In this paper, we propose a feature extraction technique that reduces the feature size and yet retains the information that is most critical for the classification. The proposed feature extraction approach starts by abstracting stack traces of function calls into sequences of package names, by replacing each function with the package in which it is defined. We then segment these traces into multiple N-grams of variable length and map them to fixed-size sparse feature vectors, which are used to measure the distance between the stack trace of incoming bug report with a historical set of bug reports stack traces. The linear combination of stack trace similarity and non-textual fields such as component and severity are then used to measure the distance of a bug report with a historical set of bug reports. We show the effectiveness of our approach by applying it to the Eclipse bug repository that contains tens of thousands of bug reports. Our approach outperforms the approach that uses distinct function names, while significantly reducing the processing time.","","978-1-5386-0592-9","10.1109/QRS.2017.35","","https://ieeexplore.ieee.org/stamp/stamp.jsp?arnumber=8009929","Duplicate bug reports;data mining;stack traces;software maintenance;software reliability","Computer bugs;Feature extraction;Dictionaries;Software;Reliability;Data mining","","33","","23","IEEE","14 Aug 2017","25-29 July 2017","25-29 July 2017","IEEE","IEEE Conferences"
"Pipelined Neural Networks for Phrase-Level Sentiment Intensity Prediction","L. -C. Yu; J. Wang; K. R. Lai; X. Zhang","Department of Information Management, Yuan Ze University, Taoyuan, Taiwan; Department of Computer Science and Engineering, Yuan Ze University, Taoyuan, Taiwan; Department of Computer Science and Engineering, Yuan Ze University, Taoyuan, Taiwan; School of Information Science and Engineering, Yunnan University, Kunming, P.R. China",IEEE Transactions on Affective Computing,"14 Aug 2020","2020","11","3","447","458","Linguistic modifiers such as negators (e.g., not), intensifiers (e.g., very) and modals (e.g., would) are commonly used in expressing opinions. These modifiers play an important role in recognizing the sentiment intensity of multi-word phrases because they may lead to an intensity shift and polarity reversal for the words they modify. Appropriately modeling the effect of such modifiers on the intensity shift can greatly improve the performance of phrase-level sentiment intensity prediction. To this end, this paper proposes two neural network (NN) models organized in a pipelined fashion to determine 1) the intensity of individual words and 2) the shift weights of modifiers representing the degrees of intensity change for the words they modify. The intensity of a phrase can then be determined by combining the intensity of the constituent word and the shift weight of the modifier within the phrase. When measuring the word intensity, the first NN model introduces a hidden layer as a filter to select appropriate similar seed words in the prediction process. Automatic word intensity prediction can address the unknown intensities of words not covered in sentiment lexicons. In learning the modifier weights, the second NN model considers both the weights of individual modifiers and groups of modifiers to capture various intensity shift effects caused by them. Experiments on a SemEval-2016 dataset showed that the proposed method yielded better prediction performance for both single words and multi-word phrases.","1949-3045","","10.1109/TAFFC.2018.2807819","Ministry of Science and Technology, Taiwan(grant numbers:MOST 105-2221-E-155-059-MY2,MOST 105-2218-E-006-028); ","https://ieeexplore.ieee.org/stamp/stamp.jsp?arnumber=8295270","Sentiment analysis;sentiment intensity;modifier weight learning;neural network","Artificial neural networks;Predictive models;Switches;Learning systems;Linear regression;Prediction algorithms","","13","","52","IEEE","20 Feb 2018","1 July-Sept. 2020","","IEEE","IEEE Journals"
"Comparison of Machine Learning Techniques for Sentiment Analysis","S. Mishra; M. Aggarwal; S. Yadav; Y. Sharma","Department of Information Technology, KIET Group of Institutions, Ghaziabad, UP, India; Department of Information Technology, KIET Group of Institutions, Ghaziabad, UP, India; Department of Information Technology, KIET Group of Institutions, Ghaziabad, UP, India; Department of Information Technology, KIET Group of Institutions, Ghaziabad, UP, India","2023 3rd International Conference on Advances in Computing, Communication, Embedded and Secure Systems (ACCESS)","7 Aug 2023","2023","","","184","191","Sentiment analysis is the process of categorizing and locating the emotions represented in a textual source. Sentiment analysis can be used widely in different areas, such as customer review data, feedback data classification, survey responses, and social media comments. Tweets on Twitter contain a variety of sentiments reflecting the perception, thinking, and working background of the user. With the help of the sentiment analyzer, it can define the response of others on any matter or subject of interest. Here, we used machine learning-based NLP (natural language processing) and text analysis technology to define an automated model that can classify the sentiment of a large dataset. Here we used the following three machine-learning classifiers: logistic regression, SVM, and Bernoulli Naïve Bayes. The effectiveness and performance of these classifiers are assessed using F1 scores and accuracy. The accuracy of these models is 83%(LR), 81%(SVM), and 80%(BNB) So logistic regression model provides the best result among these.","","979-8-3503-4616-9","10.1109/ACCESS57397.2023.10200806","","https://ieeexplore.ieee.org/stamp/stamp.jsp?arnumber=10200806","Sentiment;Svm;Logistic regression;Bernoulli Naïve Bayes;Seaborn;Token;Vector etc","Support vector machines;Analytical models;Sentiment analysis;Logistic regression;Text analysis;Social networking (online);Computational modeling","","9","","15","IEEE","7 Aug 2023","18-20 May 2023","18-20 May 2023","IEEE","IEEE Conferences"
"Identifying Abusive Comments in Hebrew Facebook","C. Liebeskind; S. Liebeskind","Department of Computer Science, Jerusalem College of Technology, Jerusalem, Israel; Department of Computer Science, Jerusalem College of Technology, Jerusalem, Israel",2018 IEEE International Conference on the Science of Electrical Engineering in Israel (ICSEE),"21 Feb 2019","2018","","","1","5","In this study, we aim to classify comments as abusive or non-abusive. We develop a Hebrew corpus of user comments annotated for abusive language. Then, we investigate highly sparse n-grams representations as well as denser character n-grams representations for comment abuse classification. Since the comments in social media are usually short, we also investigate four dimension reduction methods, which produce word vectors that collapse similar words into groups. We show that the character n-grams representations outperform all the other representation for the task of identifying abusive comments.","","978-1-5386-6378-3","10.1109/ICSEE.2018.8646190","","https://ieeexplore.ieee.org/stamp/stamp.jsp?arnumber=8646190","abusive comments;dimension reduction;n-grams;n-grams characters;semantic analysis;word embedding","Semantics;Blacklisting;Support vector machines;Dimensionality reduction;Feature extraction;Matrix decomposition;Electrical engineering","","8","","43","IEEE","21 Feb 2019","12-14 Dec. 2018","12-14 Dec. 2018","IEEE","IEEE Conferences"
"Personality Prediction Based on Contextual Feature Embedding SBERT","M. A. Akber; T. Ferdousi; R. Ahmed; R. Asfara; R. Rab","Department of Computer Science and Engineering, Ahsanullah University Of Science and Technology (AUST), Dhaka, Bangladesh; Department of Computer Science and Engineering, Ahsanullah University Of Science and Technology (AUST), Dhaka, Bangladesh; Department of Computer Science and Engineering, Ahsanullah University Of Science and Technology (AUST), Dhaka, Bangladesh; Department of Computer Science and Engineering, Ahsanullah University Of Science and Technology (AUST), Dhaka, Bangladesh; Department of Computer Science and Engineering, Ahsanullah University Of Science and Technology (AUST), Dhaka, Bangladesh",2023 IEEE Region 10 Symposium (TENSYMP),"28 Aug 2023","2023","","","1","5","Personality prediction defines an individual's interior self and provides an overview of their behavioral characteristics. Individuals can develop personally and professionally with its aid. Since its inception, the MBTI has become one of the most valuable instruments available due to its widespread application in a variety of fields. Typically, psychologists use questionnaires or conduct interviews with subjects to make predictions. However, because it is only a question-and-answer session, it is prone to error. In this paper, an implicit model is suggested in order to optimize the process using machine learning. The primary objective of this paper is to use sentence transformers to discern the context of user-written social media posts in order to automate the process. In our proposed work, various text pre-processing techniques, such as data cleansing, stopword removal, and data balancing techniques such as random oversampling, are utilized. The context of the text posts is determined using Sentence-BERT (SBERT), a pre-trained model created especially for sentence-level embeddings. Using the Myers-Briggs Type Indicator (MBTI) and a variety of machine learning techniques, such as Support Vector Machines (SVM), Logistic Regression (LR), K-Nearest Neighbors (KNN) and Random Forest (RF) Classifier, it is possible to predict people's personalities based on text. SBERT combined with the Random Forest Classifier performs outstandingly to predict the MBTI personality.","2642-6102","978-1-6654-8258-5","10.1109/TENSYMP55890.2023.10223609","","https://ieeexplore.ieee.org/stamp/stamp.jsp?arnumber=10223609","Sentence-BERT (SBERT);Support Vector Machines;Logistic Regression;Random Forest Classifier;K-Nearest Neighbors;Myers-Briggs Type Indicator (MBTI);Oversampling","Logistic regression;Social networking (online);Instruments;Support vector machine classification;Psychology;Forestry;Transformers","","6","","16","IEEE","28 Aug 2023","6-8 Sept. 2023","6-8 Sept. 2023","IEEE","IEEE Conferences"
"Detection of SQL Injection Attacks Using Machine Learning Algorithms Based on NLP-Based Feature Extraction","H. C. Altunay","Carsamba Ticaret Borsasi Meslek Yüksekokulu, Ondokuz Mayis Üniversitesi, Samsun, Türkiye",2024 9th International Conference on Computer Science and Engineering (UBMK),"11 Dec 2024","2024","","","468","472","SQL injection attack is one of the cyber attack types that puts individuals and institutions in a difficult situation in terms of data disclosure and material damage. This attack type, which is frequently preferred due to its case of use, has emerged with different usage features in recent years. In this study, various machine learning algorithms were tested to detect SQL Injection attacks. In the data pre-processing section, feature extraction was performed using Natural Language Processing techniques. While the relevance of expressions to each other was calculated with the Word Level TF-IDF method, term search was also performed. In the study, the classification process was performed using convolutional neural network, support vector machine, naive bayes and logistic regression from machine learning methods. At the end of the experimental study, it was found that convolutional neural network was the model that detected SQL Injection attacks with the highest success.","2521-1641","979-8-3503-6588-7","10.1109/UBMK63289.2024.10773483","","https://ieeexplore.ieee.org/stamp/stamp.jsp?arnumber=10773483","SQLInjection;machine learning;natural language processing;convolutional neural network;support vector machine","Support vector machines;Logistic regression;Machine learning algorithms;Machine learning;SQL injection;Feature extraction;Vectors;Natural language processing;Convolutional neural networks;Cyberattack","","3","","0","IEEE","11 Dec 2024","26-28 Oct. 2024","26-28 Oct. 2024","IEEE","IEEE Conferences"
"Continuous Finger Joint Angle Estimation With sEMG Signals","S. Zhou; K. Yin","School of Astronautics, Northwestern Polytechnical University, Xi’an, Shaanxi Province, China; Nanjing Research Institute of Electronic Technology, Nanjing, Jiangsu Province, China","2019 IEEE THE 2nd INTERNATIONAL CONFERENCE ON MICRO/NANO SENSORS for AI, HEALTHCARE, AND ROBOTICS (NSENS)","21 Dec 2020","2019","","","6","10","The current sensing devices for measuring continuous finger movement are either restrictive to users (data glove) or easily influenced by external environment (optical or magnetic trackers based method). Therefore, the objective of this study is developing a continuous finger movement tracking system that is more easy and comfortable to use. The surface electromyography (sEMG) signals applied in this study were collected from human forearm with 10 electrodes, and transmitted to the computer via cables. Timedomain features were extracted and further filtered with a low-pass filter to smooth the features. Three partial least square regression (PLSR) based movement estimation models had been built for the three movements investigated in this study, and one movement recognition model was constructed to determine which movement estimation model would be applied for the new incoming samples. The prediction accuracy evaluated in terms of Pearson's correlation coefficient ranges from 0.84 to 0.91 for single finger flexion, and ranges from 0.53 to 0.83 for the movement of fingers flexed together in fist. The normalized root mean square error (NRMSE) ranges from 0.04 to 0.1 for single finger flexion, and ranges from 0.046 to 0.14 for the movement of fingers flexed together in fist. The effectiveness of PLSR has also been proved by comparing its performance with linear regression (LR) model.","","978-1-7281-6652-0","10.1109/NSENS49395.2019.9293963","National Natural Science Foundation of China; ","https://ieeexplore.ieee.org/stamp/stamp.jsp?arnumber=9293963","sEMG;PLSR;LR;regression;myoelectric control;ninaPro","Sensors;Robot sensing systems;Medical services;Conferences;Artificial intelligence","","2","","16","IEEE","21 Dec 2020","31 Oct.-2 Nov. 2019","31 Oct.-2 Nov. 2019","IEEE","IEEE Conferences"
"Sentiment Classification Of E-Commerce Feedback Using Machine Learning Algorithms","K. C.; H. Mohamed; S. Mythili","Master of Computer Science, Karpagam Academy of Higher Education, Coimbatore, India; KPPIM, UiTM Cawangan Terengganu Kampus Kuala Terengganu, Terengganu, Malaysia; Department of Computer Science, Karpagam Academy of Higher Education, Coimbatore, India",2024 International Conference on Emerging Research in Computational Science (ICERCS),"27 Feb 2025","2024","","","1","7","In the swiftly changing landscape of e-commerce, it is essential for businesses to comprehend consumer sentiment to improve customer satisfaction and effectively adapt to market changes. An assessment was conducted on the performance of three algorithms for machine learning Support Vector Machines (SVM), Logistic Regression, and Naive Bayes for sentiment analysis of user-generated content on Twitter. A thorough methodology was implemented, including gathering data, preprocessing, extracting features, and evaluating the model to assess how well these methods work. Methods like TFIDF and n-grams enhanced the model's understanding of contextual sentiment. SVM exhibited high accuracy, attributed to its exceptional capability to manage high-dimensional data and establish robust decision boundaries. Nonetheless, challenges persist in interpreting neutral sentiments and ambiguous language. The investigation into complex deep learning methods, encompassing recurrent Transformers and neural networks, presents opportunities for additional advancements in sentiment classification. These findings underscore the significance of sentiment analysis in assisting e-commerce platforms like Amazon, Flipkart, and Meesho in refining their product offerings and marketing strategies, ultimately fostering increased customer engagement and satisfaction.","","979-8-3315-3496-7","10.1109/ICERCS63125.2024.10895740","","https://ieeexplore.ieee.org/stamp/stamp.jsp?arnumber=10895740","Sentiment analysis;Support Vector Machines (SVM);E-commerce;Customer reviews;Text Classification;Data pre-processing;customer feedback analysis;TF-IDF;Bag-ofWords;Opinion mining;Marketing strategies","Support vector machines;Sentiment analysis;Logistic regression;Accuracy;Machine learning algorithms;High dimensional data;User-generated content;Customer satisfaction;Feature extraction;Electronic commerce","","","","15","IEEE","27 Feb 2025","12-14 Dec. 2024","12-14 Dec. 2024","IEEE","IEEE Conferences"
"A Comparative Study of Sentiment Analysis on Amazon Customer Reviews: Deep Learning vs. Machine Learning with Balanced and Imbalanced Datasets","M. I. Corak; C. Wang; X. Zhang","Dept. of Computer Science, CUNY College of Staten Island, Staten Island, NY, USA; Dept. of Computer Science, CUNY LaGuardia Community College, Long Island City, NY, USA; Dept. of Computer Science, CUNY College of Staten Island, Staten Island, NY, USA","2025 IEEE 16th Annual Ubiquitous Computing, Electronics & Mobile Communication Conference (UEMCON)","4 Dec 2025","2025","","","0014","0020","This research compares deep learning and traditional machine learning methods for sentiment analysis, highlighting model selection, data balancing, and efficiency affect large-scale text classification. The research [1] evaluates five traditional machine learning models - Random Forest Classifier (RFC), Logistic Regression Classifier (LRC), Bernoulli Naïve Bayes (BNB), Linear Support Vector Classifier (L-SVC) and Multinomial Naïve Bayes (MNB) - trained using Bag of Words (BoW) and Term Frequency-Inverse Document Frequency (TFIDF), alongside deep learning architectures [2] including long short-term memory (LSTM), bidirectional LSTM, Recurrent Neural Networks (RNN), Gated Recurrent Units (GRU), Attention mechanisms, and FastText embeddings. A key aspect of this study is the analysis of model performance across balanced and imbalanced datasets, exploring how data distribution affects sentiment classification accuracy. The findings indicate that deep learning models outperform traditional machine learning models in handling long-range dependencies and contextual meaning in text. However, machine learning models exhibit competitive performance with lower computational costs, making them viable for real-time applications.","","979-8-3315-6501-5","10.1109/UEMCON67449.2025.11267657","","https://ieeexplore.ieee.org/stamp/stamp.jsp?arnumber=11267657","Deep Learning;Machine Learning;Sentiment Analysis;Customer Reviews;E-commerce;Social Media;Amazon","Deep learning;Training;Analytical models;Sentiment analysis;Accuracy;Reviews;Computational modeling;Machine learning;Data models;Context modeling","","","","6","IEEE","4 Dec 2025","22-24 Oct. 2025","22-24 Oct. 2025","IEEE","IEEE Conferences"
"A Fast Text-Based Communication System for Handicapped Aphasiacs","Y. -F. Fu; C. -S. Ho","Department of Management of Information Systems, China University of Technology, Taipei, Taiwan; Department of Information Technology and Communication, Jiangnan University, Taipei, Taiwan",2009 Fifth International Conference on Intelligent Information Hiding and Multimedia Signal Processing,"17 Nov 2009","2009","","","583","594","In general, AAC systems are equipped with special access mechanisms, since the users lack the fine motor-control required to operate such systems with standard peripheral devices. The major problem with such AAC systems is low text typing speed. This paper presents a fast text-based communication system, enabled by finger language and supported by a virtual keyboard, to aim at efficient text entry. A handicapped aphasiac can enter text via the virtual keyboard by wearing a data glove to make proper finger gestures and use them to directly select the letters on the keyboard. The technique centers on the concept of finger language components. We have developed a finger language recognition system that could recognize static finger language components from the finger gestures of a handicapped aphasiac. We then extended the technique to continuous input of finger language components and developed a text-based communication environment for handicapped aphasiacs.","","978-1-4244-4717-6","10.1109/IIH-MSP.2009.251","","https://ieeexplore.ieee.org/stamp/stamp.jsp?arnumber=5337389","handicapped aphasiac;data glove;finger gestures;finger language;neural network;Augmentative and Alternative Communication","Fingers;Natural languages;Handicapped aids;Keyboards;Deafness;Data gloves;Multimedia systems;Signal processing;Computer science;Information technology","","8","4","10","IEEE","17 Nov 2009","12-14 Sept. 2009","12-14 Sept. 2009","IEEE","IEEE Conferences"
"A Comparative Analysis of Machine Learning Models for Fake News Detection","D. A. Subhash; N. Sharma; A. Kumar; S. K. Jha; Ishica; R. Pandey","Computer Science and Engineering, Chandigarh University, Mohali, Punjab; Computer Science and Engineering, Chandigarh University, Mohali, Punjab; Computer Science and Engineering, Chandigarh University, Mohali, Punjab; Computer Science and Engineering, Chandigarh University, Mohali, Punjab; Computer Science and Engineering, Chandigarh University, Mohali, Punjab; Computer Science and Engineering, Chandigarh University, Mohali, Punjab",2023 3rd International Conference on Innovative Mechanisms for Industry Applications (ICIMIA),"18 Apr 2024","2023","","","760","767","The rapid increase in the sharing of fake news poses a major threat in this modern digital world to information integrity. This issue can be addressed by using the Machine Learning (ML) models. This research is based on comparative study of four such ML models- Random Forest Classifier, Logistic Regression, Decision Tree, and Gradient Boosting Classifier. Various performance metrics such as precision, accuracy, recall, Fl-score are employed for model evaluation. The dataset is being used to train the features based on textual content and metadata. This particular analysis produces the results like Random Forest Classifier, which exhibits highest accuracy and provides reliable outcomes in differentiating fake news and actual news. Additionally, the research underscores the importance of data preprocessing, feature selection, and model hyper-parameter tuning in optimising the efficiency in fake news detection. This study provides valuable insights to combat the spreading of fake news in this digital age.","","979-8-3503-4363-2","10.1109/ICIMIA60377.2023.10425817","","https://ieeexplore.ieee.org/stamp/stamp.jsp?arnumber=10425817","Machine Learning;Random Forest Classification;Logistic Regression;Decision tree;Gradian Boosting Classifier","Logistic regression;Analytical models;Feature extraction;Boosting;Fake news;Random forests;Information integrity","","2","","16","IEEE","18 Apr 2024","21-23 Dec. 2023","21-23 Dec. 2023","IEEE","IEEE Conferences"
